Task name,Assignee,Due,Epics
PRD Outline and Workshop,,,Product Requirements Documentation (PRD)
Develop User Stories and Acceptance Criteria,,,Product Requirements Documentation (PRD)
Define Non-Functional Requirements,,,Product Requirements Documentation (PRD)
Develop Risk Management Plan,,,Product Requirements Documentation (PRD)
Finalize and Review PRD,,,Product Requirements Documentation (PRD)
Design Sprint and Wireframing,,,UX/UI Design and Prototyping
High-Fidelity Mockups and Design System Development,,,UX/UI Design and Prototyping
Interactive Prototyping and Usability Testing,,,UX/UI Design and Prototyping
Design Documentation and Handoff,,,UX/UI Design and Prototyping
Technical Stack Confirmation and Architecture Planning,,,Technical Architecture and Infrastructure Planning
Database Schema Design and API Planning,,,Technical Architecture and Infrastructure Planning
Security and Compliance Architecture Design,,,Technical Architecture and Infrastructure Planning
DevOps and Infrastructure Setup,,,Technical Architecture and Infrastructure Planning
Technical Debt and Refactoring Plan,,,Technical Architecture and Infrastructure Planning
Sprint Planning and Backlog Grooming,,,Agile Development Preparation
Agile Team Setup and Training,,,Agile Development Preparation
Set Up Agile Ceremonies and Reporting,,,Agile Development Preparation
Establish Continuous Integration and Continuous Deployment (CI/CD) Pipeline,,,Agile Development Preparation
Define Metrics and KPIs for Agile Performance,,,Agile Development Preparation
Develop Prototypes for Key Features and Flows,,,Product Validation and Feedback Loops
Conduct User Testing Sessions,,,Product Validation and Feedback Loops
Synthesize Feedback and Iterate on Designs,,,Product Validation and Feedback Loops
Establish Ongoing Feedback Mechanisms,,,Product Validation and Feedback Loops
Develop GTM Strategy Document,,,GTM Strategy Alignment with Product Development
Develop Pre-Launch Marketing Content,,,GTM Strategy Alignment with Product Development
Coordinate Product and Marketing Alignment Workshops,,,GTM Strategy Alignment with Product Development
Conduct a Final Design and Product Review,,,Final Preparation for Phase 3
Technical Feasibility Assessment and Adjustment,,,Final Preparation for Phase 3
Prepare Development Environment and Repositories,,,Final Preparation for Phase 3
Align on Initial Sprints and Milestones for Phase 3,,,Final Preparation for Phase 3
Stakeholder Alignment and Phase 3 Kickoff Preparation,,,Final Preparation for Phase 3
